{
  "childProductRole": "ullamco",
  "id": "in aute ad cillum elit",
  "parentProductRole": "reprehenderit deserunt minim ad consectetur",
  "auditInfo": {
    "isDeleted": null,
    "createdBy": "sed ea",
    "updatedBy": "qui",
    "updatedDate": "1966-10-14T18:29:38.152Z",
    "createdDate": null
  }
}
